questions,answers
what is ai?,"AI, or Artificial Intelligence, refers to the simulation of human intelligence in machines or computer systems. It involves the development of computer programs and algorithms that enable machines to perform tasks that typically require human intelligence, such as understanding natural language, recognizing patterns, learning from data, making decisions, and solving complex problems. AI aims to create systems that can mimic human cognitive functions, adapt to changing situations, and perform tasks with a level of autonomy."
what is machine learning?,"Machine Learning (ML) is a subset of artificial intelligence (AI) that focuses on the development of algorithms and statistical models that enable computer systems to learn from and make predictions or decisions based on data. In essence, machine learning allows machines to recognize patterns, make inferences, and improve their performance on a specific task without being explicitly programmed for that task. It's a field of study that emphasizes the development of algorithms that can learn and adapt.

"
what is deep learning ?,"Deep Learning is a subset of machine learning that focuses on the development of artificial neural networks, particularly deep neural networks with many interconnected layers, referred to as ""deep"" networks. Deep learning algorithms aim to model and understand complex patterns and representations in data by simulating the structure and function of the human brain's neural networks. These networks are designed to automatically learn hierarchical features from data, making them particularly effective for tasks such as image and speech recognition, natural language processing, and various other pattern recognition tasks."
why statistics are useful in ml?,"Data Understanding and Preprocessing: Statistics helps in the initial exploration and understanding of data. Descriptive statistics provide insights into data distribution, central tendencies, and variability, which inform data preprocessing steps such as normalization, scaling, and handling missing values."
what is nlp,"NLP, or Natural Language Processing, is a subfield of artificial intelligence (AI) that focuses on the interaction between computers and human languages. NLP seeks to enable computers to understand, interpret, and generate human language in a way that is both valuable and meaningful. It encompasses a wide range of tasks and applications related to language understanding and generation."
what is sentiment analysis,"Sentiment Analysis, also known as Opinion Mining, is a natural language processing (NLP) technique that involves determining the sentiment or emotional tone expressed in a piece of text, such as a sentence, paragraph, or document. Sentiment analysis aims to understand whether the text conveys a positive, negative, or neutral sentiment, as well as the strength and subjectivity of the sentiment."
what are the types of supervised learning,"Supervised learning is a type of machine learning where the algorithm learns from labeled training data to make predictions or decisions without human intervention. In supervised learning, each data point in the training dataset is associated with a target variable or label, which the model aims to predict. There are several types of supervised learning algorithms, each suited to different types of problems and data:"
what is classification,"Classification is a fundamental concept in machine learning and statistics. It refers to the process of categorizing or assigning data points to predefined classes or categories based on their characteristics or features. In classification, each data point belongs to one and only one class, and the goal is to learn a model that can make accurate predictions or decisions about the class membership of new, unseen data points."
what is regression,"Regression is a type of supervised machine learning technique used for predicting a continuous numerical value or quantity based on input features or variables. In regression analysis, the goal is to establish a relationship or model that can approximate and predict a real number as the output. This is in contrast to classification, where the goal is to predict a discrete class or category."
what is neural network,"Neural networks are a class of machine learning models inspired by the structure and function of the human brain. They are a fundamental component of deep learning, a subfield of machine learning that focuses on models with multiple interconnected layers, often referred to as ""deep"" neural networks. Neural networks are used for a wide range of tasks, including image recognition, natural language processing, and reinforcement learning."
what are neurons,"In the context of neural networks and artificial neural networks, neurons (also referred to as nodes or artificial neurons) are the basic computational units that process and transmit information within the network. These artificial neurons are inspired by the neurons found in the human brain but are highly simplified computational models designed for machine learning and deep learning tasks."
